{
  "version": 1,
  "litellm": {
    "baseUrl": "http://localhost:4000/v1",
    "apiKey": "sk-123456789"
  },
  "models": {},
  "agents": {
    "sisyphus": {
      "model": "openai/gpt-4.1",
      "fallbackModels": [
        "anthropic/claude-3-7-sonnet"
      ],
      "description": "updated"
    }
  },
  "categories": {}
}